{
  "$schema": "https://json-schema.org/draft/2019-09/schema",
  "$id": "http://openscope.io/assets/schedules/schedule.schema.json",
  "title": "String of Pearls ATC simulator historical schedule schema",
  "description": "One normalized representative-day schedule for a single supported airport",
  "type": "object",
  "properties": {
    "schemaVersion": {
      "description": "Schedule contract version; only version 1 is defined",
      "const": 1
    },
    "airportIcao": {
      "description": "ICAO identifier of the schedule airport in uppercase",
      "type": "string",
      "pattern": "^[A-Z]{4}$"
    },
    "timezone": {
      "description": "IANA time zone name for the airport's local scheduledTime values",
      "$comment": "The asset validator resolves this value through Intl.DateTimeFormat and fails on unknown zones.",
      "type": "string",
      "minLength": 1
    },
    "sampleDate": {
      "description": "Representative day the schedule was sampled from, as a real YYYY-MM-DD calendar date",
      "type": "string",
      "format": "date",
      "pattern": "^\\d{4}-\\d{2}-\\d{2}$"
    },
    "source": {
      "$ref": "#source"
    },
    "flights": {
      "description": "Deterministically ordered flights (by scheduledTime then id) for the representative day",
      "type": "array",
      "minItems": 1,
      "items": {
        "$ref": "#flight"
      }
    }
  },
  "required": [
    "schemaVersion",
    "airportIcao",
    "timezone",
    "sampleDate",
    "source",
    "flights"
  ],
  "additionalProperties": false,
  "$defs": {
    "source": {
      "$anchor": "source",
      "description": "Provenance for the schedule data",
      "type": "object",
      "properties": {
        "name": {
          "description": "Human-readable name of the data source",
          "type": "string",
          "minLength": 1
        },
        "url": {
          "description": "URL the data was obtained from",
          "type": "string",
          "format": "uri",
          "minLength": 1
        },
        "retrievedAt": {
          "description": "When the data was retrieved",
          "type": "string",
          "format": "date",
          "minLength": 1
        },
        "license": {
          "description": "License or usage terms for the data",
          "type": "string",
          "minLength": 1
        },
        "coverage": {
          "description": "Honest description of what the data does and does not cover",
          "type": "string",
          "minLength": 1
        }
      },
      "required": [
        "name",
        "url",
        "retrievedAt",
        "license",
        "coverage"
      ],
      "additionalProperties": false
    },
    "flight": {
      "$anchor": "flight",
      "description": "A single scheduled movement at the schedule airport",
      "type": "object",
      "properties": {
        "id": {
          "description": "Stable identifier, unique within the schedule",
          "type": "string",
          "minLength": 1
        },
        "category": {
          "description": "Whether the flight arrives at or departs from the schedule airport",
          "type": "string",
          "enum": [
            "arrival",
            "departure"
          ]
        },
        "scheduledTime": {
          "description": "Local HH:mm time of the movement",
          "type": "string",
          "pattern": "^([01][0-9]|2[0-3]):[0-5][0-9]$"
        },
        "airlineIcao": {
          "description": "Operating airline ICAO identifier in lowercase",
          "type": "string",
          "pattern": "^[a-z]{3}$"
        },
        "flightNumber": {
          "description": "Non-empty alphanumeric flight number",
          "type": "string",
          "pattern": "^[0-9A-Za-z]+$"
        },
        "originIcao": {
          "description": "ICAO identifier of the origin airport in uppercase",
          "type": "string",
          "pattern": "^[A-Z]{4}$"
        },
        "destinationIcao": {
          "description": "ICAO identifier of the destination airport in uppercase",
          "type": "string",
          "pattern": "^[A-Z]{4}$"
        },
        "aircraftTypeIcao": {
          "description": "(Optional) uppercase alphanumeric ICAO aircraft type designator",
          "type": "string",
          "pattern": "^[0-9A-Z]+$"
        }
      },
      "required": [
        "id",
        "category",
        "scheduledTime",
        "airlineIcao",
        "flightNumber",
        "originIcao",
        "destinationIcao"
      ],
      "additionalProperties": false
    }
  }
}
